{
  "id": "sales/sales-coach",
  "version": "1.0.0",
  "name": "Sales Coach",
  "emoji": "\ud83c\udfcb\ufe0f",
  "color": "#E65100",
  "category": "sales",
  "tags": ["sales-coaching", "pipeline-review", "call-coaching", "objection-handling", "MEDDPICC", "forecast", "rep-development", "deal-strategy"],
  "description": "Asks the question that makes the rep rethink the entire deal. Pipeline review facilitation, call coaching, deal strategy, and rep development through structured Socratic methodology.",
  "when_to_use": "When you need to coach a sales rep on deal strategy, review a pipeline, debrief a sales call, design a rep development plan, or improve forecast accuracy through coaching discipline.",
  "autonomy_level": "L1",
  "params": {
    "sales_methodology": {
      "type": "string",
      "default": "MEDDPICC",
      "description": "Primary sales qualification and methodology framework (e.g., 'SPIN Selling', 'Challenger', 'Sandler', 'BANT')"
    },
    "crm_tool": {
      "type": "string",
      "default": "Salesforce",
      "description": "CRM platform used for pipeline and deal tracking (e.g., 'HubSpot', 'Pipedrive', 'Close')"
    },
    "deal_cycle": {
      "type": "string",
      "default": "30-90 day enterprise sales cycle",
      "description": "Typical deal cycle length and type (e.g., '7-day transactional', '6-month complex enterprise')"
    },
    "target_market": {
      "type": "string",
      "default": "Mid-market B2B",
      "description": "Primary target market segment (e.g., 'SMB', 'Enterprise', 'PLG-to-sales assisted')"
    },
    "team_context": {
      "type": "string",
      "default": "Sales team of 8-12 reps",
      "description": "Team size and working style for calibrating coaching approach"
    }
  },
  "files": ["SOUL.md.tmpl", "AGENTS.md.tmpl", "IDENTITY.md.tmpl", "TOOLS.md.tmpl"],
  "skills": [],
  "tools_required": ["Read", "Write", "Edit", "Bash", "Glob", "Grep"],
  "tools_optional": ["WebFetch", "WebSearch"],
  "channel_suggestion": "#sales-coaching",
  "model_recommendation": {
    "primary": "anthropic/claude-sonnet-4-5",
    "rationale": "Strong reasoning for Socratic coaching and deal analysis; upgrade to Opus for complex multi-deal strategy sessions and organizational coaching program design."
  },
  "pairs_well_with": ["sales/pipeline-analyst"],
  "adapted_from": {
    "source": "agency-agents",
    "original": "sales/sales-sales-coach"
  },
  "onboarding": {
    "questions": [
      { "key": "sales_methodology", "ask": "团队使用什么销售方法论？（MEDDPICC / SPIN / Challenger / Sandler）", "required": true },
      { "key": "crm_tool", "ask": "CRM 工具是什么？（Salesforce / HubSpot / Pipedrive）", "required": true },
      { "key": "deal_cycle", "ask": "典型成交周期多长？（如 30-90 天企业级）", "required": false },
      { "key": "target_market", "ask": "目标市场是什么？（SMB / 中型企业 / 大企业）", "required": false },
      { "key": "team_context", "ask": "销售团队有多少人？工作方式如何？", "required": false }
    ]
  },
  "tools_deny": ["Bash"]
}
