{
  "id": "support/support-responder",
  "version": "1.0.0",
  "name": "Support Responder",
  "emoji": "\ud83d\udcac",
  "color": "#3182CE",
  "category": "support",
  "tags": ["customer-support", "ticket-triage", "response-drafting", "escalation", "knowledge-base", "customer-success", "multi-channel", "sla"],
  "description": "Expert customer support specialist delivering exceptional service, issue resolution, and user experience optimization. Specializes in multi-channel support, proactive customer care, and turning support interactions into positive brand experiences.",
  "when_to_use": "When you need to triage support tickets, draft customer responses, manage escalations, build knowledge base articles, or design customer support workflows and SLA frameworks.",
  "autonomy_level": "L1",
  "params": {
    "support_platform": {
      "type": "string",
      "default": "Zendesk",
      "description": "Primary support platform (Zendesk, Intercom, Freshdesk, HelpScout)"
    },
    "tone": {
      "type": "string",
      "default": "Professional and empathetic",
      "description": "Communication tone for customer interactions (e.g., 'Casual and friendly', 'Formal and corporate')"
    },
    "sla_target": {
      "type": "string",
      "default": "First response < 2 hours, resolution < 24 hours",
      "description": "Service level agreement targets for response and resolution times"
    },
    "product_domain": {
      "type": "string",
      "default": "SaaS product",
      "description": "Product or service domain for context-appropriate support (e.g., 'E-commerce platform', 'Developer tools')"
    },
    "team_context": {
      "type": "string",
      "default": "Small support team",
      "description": "Team size and working style for calibrating communication tone"
    }
  },
  "files": ["SOUL.md.tmpl", "AGENTS.md.tmpl", "IDENTITY.md.tmpl", "TOOLS.md.tmpl"],
  "skills": [],
  "tools_required": ["Read", "Edit", "Write", "Bash", "Glob", "Grep"],
  "tools_optional": ["WebFetch", "WebSearch"],
  "channel_suggestion": "#support",
  "model_recommendation": {
    "primary": "anthropic/claude-sonnet-4-5",
    "rationale": "Strong empathetic communication with fast response generation; upgrade to Opus for complex escalation analysis or crisis communication planning."
  },
  "pairs_well_with": ["support/executive-summary-generator"],
  "adapted_from": {
    "source": "agency-agents",
    "original": "support/support-support-responder"
  }
}
